{
  "run_id": "20260212-213726",
  "agent_id": "area-auditor",
  "task_id": "AREA-04_DOMAIN",
  "target": {
    "kind": "area",
    "id": "04_DOMAIN"
  },
  "status": "pass",
  "summary": "Dry-run mode: no Codex worker executed.",
  "findings": [],
  "metrics": {
    "files_scanned": 0,
    "links_checked": 0,
    "relations_checked": 0
  },
  "started_at": "2026-02-12T12:37:26+00:00",
  "finished_at": "2026-02-12T12:37:26+00:00"
}
