{"run_id":"20260212-211025","agent_id":"area-auditor","task_id":"AREA-06_BACKEND","target":{"kind":"area","id":"06_BACKEND"},"status":"warn","summary":"Scoped backend SSOT audit found 2 issues: one required-doc manifest drift in README and one medium test-rule traceability gap for data write-policy rules. No broken markdown/wiki links were found in `06_BACKEND` documents.","findings":[{"severity":"low","code":"REQUIRED_DOC_DECLARED_BUT_MISSING","message":"`06_BACKEND/README.md` declares `BE_AGENT_SPLIT.md` in the backend file structure, but that file is missing in the scoped area.","dedupe_key":"06_BACKEND:BE_AGENT_SPLIT_MISSING","evidence":[{"path":"06_BACKEND/README.md","line":19,"snippet":"BE_AGENT_SPLIT.md # 병렬 에이전트 분할 기준"},{"path":"06_BACKEND/BE_AGENT_SPLIT.md","line":null,"snippet":null}],"proposed_fix":"Either add `06_BACKEND/BE_AGENT_SPLIT.md` with the intended backend agent split criteria or remove/update the stale entry in `06_BACKEND/README.md`."},{"severity":"medium","code":"TEST_RULE_COVERAGE_GAP_WRITE_POLICY","message":"Backend data write-policy SSOT rules (write-through/write-back and GAME_FINISHED/termination flush semantics) are defined but not explicitly reflected in backend test-rule coverage statements, reducing rule-to-test traceability.","dedupe_key":"06_BACKEND:WRITE_POLICY_TEST_COVERAGE_GAP","evidence":[{"path":"06_BACKEND/BE_DATA_MODEL_RULES.md","line":17,"snippet":"- write-through: 상태 변경 즉시 DB에 기록한다."},{"path":"06_BACKEND/BE_DATA_MODEL_RULES.md","line":19,"snippet":"- write-back 대상은 GAME_FINISHED 또는 룸/게임 종료 시 DB 반영이 필수다."},{"path":"06_BACKEND/BE_TEST_RULES.md","line":37,"snippet":"## 4. 데이터 정합성 테스트"},{"path":"06_BACKEND/BE_TEST_RULES.md","line":38,"snippet":"- DTO → Entity 매핑 테스트를 작성한다."}],"proposed_fix":"Extend `06_BACKEND/BE_TEST_RULES.md` with explicit test coverage statements for write-through persistence and write-back flush verification on GAME_FINISHED/room-or-game termination conditions."}],"metrics":{"files_scanned":8,"links_checked":17,"relations_checked":3},"started_at":"2026-02-12T12:10:25Z","finished_at":"2026-02-12T12:13:38Z"}