{"run_id":"20260212-211025","agent_id":"area-auditor","task_id":"AREA-04_DOMAIN","target":{"kind":"area","id":"04_DOMAIN"},"status":"warn","summary":"04_DOMAIN documents are present and linked, but persistence timing semantics are ambiguous for several persistent entities during Phase 2.","findings":[{"severity":"medium","code":"DOMAIN_WRITE_POLICY_DRIFT","message":"Persistent entities are defined with default write-through policy, but the Phase 2 timing table marks DB writes as \"필요 시 write-through\", creating ambiguous persistence semantics for runtime logs.","dedupe_key":"04_domain_write_policy_phase2_ambiguity","evidence":[{"path":"04_DOMAIN/DATA_MODEL.md","line":53,"snippet":"- 기본값: persistent = write-through. 예외는 아래 표에 명시한다."},{"path":"04_DOMAIN/DB_NOTES.md","line":104,"snippet":"- 기본값: persistent는 write-through."},{"path":"04_DOMAIN/REDIS_DB_TIMING.md","line":27,"snippet":"| Phase 2: 게임 진행 | 인게임 이벤트 | 즉시 반영 | 필요 시 write-through | ITEM_USAGE, SPELL_USAGE, SUBMISSION, GAME_ITEM_PURCHASE, GAME_SPELL_PURCHASE |"}],"proposed_fix":"Align Phase 2 wording with SSOT policy by defining these entities as always write-through, or explicitly add them as write-back exceptions in DATA_MODEL.md and DB_NOTES.md."}],"metrics":{"files_scanned":4,"links_checked":9,"relations_checked":3},"started_at":"2026-02-12T12:10:56Z","finished_at":"2026-02-12T12:12:32Z"}