{
  "run_id": "20260212-213717",
  "agent_id": "relation-auditor",
  "task_id": "REL-DOMAIN-BACKEND",
  "target": {
    "kind": "relation",
    "id": "DOMAIN_BACKEND"
  },
  "status": "pass",
  "summary": "Dry-run mode: no Codex worker executed.",
  "findings": [],
  "metrics": {
    "files_scanned": 0,
    "links_checked": 0,
    "relations_checked": 0
  },
  "started_at": "2026-02-12T12:37:17+00:00",
  "finished_at": "2026-02-12T12:37:17+00:00"
}
