{
  "run_id": "20260212-211025",
  "agent_id": "duplication-auditor",
  "task_id": "DUP-OWNERSHIP",
  "target": {
    "kind": "duplication",
    "id": "OWNERSHIP_VIOLATION"
  },
  "status": "fail",
  "summary": "Found 2 ownership violations in scope. A critical SSOT breach exists where Frontend docs redefine Product-owned UI copy SSOT, and additional cross-area ownership drift statements assign copy ownership to Frontend from Design/Frontend docs.",
  "findings": [
    {
      "severity": "critical",
      "code": "source_of_truth_violation.copy_ssot_redefined",
      "message": "`05_FRONTEND/FE_NOTIFICATION_MESSAGES.md` redefines Product-owned UI copy by declaring itself the single document for message keys/Korean text and providing canonical copy mappings, while Product explicitly owns UI copy SSOT in `01_PRODUCT/COPY_TEXT.md`.",
      "dedupe_key": "ownership_violation:copy:ssot_redefined_in_frontend",
      "evidence": [
        {
          "path": "01_PRODUCT/README.md",
          "line": 6,
          "snippet": "- 포함: 요구사항, 유저 플로우, 게임 규칙, 경제/카탈로그, UI 카피"
        },
        {
          "path": "01_PRODUCT/COPY_TEXT.md",
          "line": 2,
          "snippet": "- UI 문구는 이 파일이 단일 진실"
        },
        {
          "path": "05_FRONTEND/FE_NOTIFICATION_MESSAGES.md",
          "line": 2,
          "snippet": "- 알림 컴포넌트에서 사용하는 메시지 키와 한국어 문구를 단일 문서로 정의한다."
        },
        {
          "path": "05_FRONTEND/FE_NOTIFICATION_MESSAGES.md",
          "line": 17,
          "snippet": "| error.code ... | messageKey ... | ko ... |"
        }
      ],
      "proposed_fix": "Move canonical alert/message keys and Korean copy definitions into `01_PRODUCT/COPY_TEXT.md` (or a Product-owned copy SSOT file), and convert `05_FRONTEND/FE_NOTIFICATION_MESSAGES.md` into implementation guidance that only references Product-owned keys."
    },
    {
      "severity": "medium",
      "code": "cross_area_redefinition.copy_ownership_drift",
      "message": "Design page requirement docs and Frontend state rules repeatedly state that alert copy is managed by Frontend, which conflicts with Product’s declared ownership of UI copy SSOT and creates ambiguous cross-area ownership.",
      "dedupe_key": "ownership_violation:copy:ownership_drift_frontend_claim",
      "evidence": [
        {
          "path": "02_DESIGN/PAGE_REQUIREMENTS/LOGIN.md",
          "line": 23,
          "snippet": "- 알림 문구는 서버 `error.code` 기준으로 프론트엔드에서 관리한다."
        },
        {
          "path": "02_DESIGN/PAGE_REQUIREMENTS/BAN_PICK_SHOP.md",
          "line": 33,
          "snippet": "- 알림 문구는 서버 `error.code` 기준으로 프론트엔드에서 관리한다."
        },
        {
          "path": "05_FRONTEND/FE_STATE_RULES.md",
          "line": 44,
          "snippet": "- 서버 응답의 `error.code`에 대한 안내 문구는 프론트엔드에서 관리한다."
        },
        {
          "path": "01_PRODUCT/COPY_TEXT.md",
          "line": 2,
          "snippet": "- UI 문구는 이 파일이 단일 진실"
        }
      ],
      "proposed_fix": "Replace ownership statements in Design/Frontend docs with reference-only wording: Frontend renders Product-owned copy keys, and copy source-of-truth changes are made only under `01_PRODUCT/`."
    }
  ],
  "metrics": {
    "files_scanned": 64,
    "links_checked": 0,
    "relations_checked": 2
  },
  "started_at": "2026-02-12T12:13:40Z",
  "finished_at": "2026-02-12T12:22:14Z"
}
